Name,Description,Stages,Topics,Lesson number,Courses,Related spaces,Skills,Tags,Roles,Web URL
OpenRLHF Releases (versioning),Lesson on OpenRLHF releases (versioning).,Build; Operate,Model registry and versioning; Operations and maintenance,4,openrlhf-posttraining,,Release/version tracking; Upgrade planning,OpenRLHF; Releases; Versioning; Maintenance,Platform engineer,https://github.com/OpenRLHF/OpenRLHF/releases
Oracle: what is LLMOps? (overview),"Defines LLMOps as the operational discipline for deploying, monitoring, securing, and updating production LLM applications.",Foundations,Foundations and Lifecycle,1,oracle-llmops,,LLMOps overview (Oracle); OCI service mapping for LLMOps,Oracle; OCI; Conceptual,LLMOps engineer; Platform engineer; Technical product manager,https://www.oracle.com/artificial-intelligence/llmops/
Deploy LLM on OCI data science using byoc (vLLM),Step-by-step guide for deploying a Hugging Face LLM on OCI Data Science with a vLLM BYOC container and OpenAI-compatible endpoints.,Build,Deployment and serving,2,oracle-llmops,,BYOC serving deployment (OCI Data Science); Containerized LLM serving (vLLM),Oracle; OCI Data Science; BYOC; vLLM; Serving,Platform engineer; ML engineer,https://raw.githubusercontent.com/oracle-samples/oci-data-science-ai-samples/main/LLM/deploy-llm-byoc.md
OCI Monitoring service overview (official docs),"Introduces OCI Monitoring fundamentals for metrics, alarms, and resource health tracking across cloud services.",Operate,Observability and tracing,3,oracle-llmops,,Observability dashboarding; Logs/metrics/traces analysis; Alerting configuration,Oracle; OCI Observability; Monitoring; Documentation,LLMOps engineer,https://docs.oracle.com/en-us/iaas/Content/Monitoring/Concepts/monitoringoverview.htm
Monitoring OCI DevOps performance (a-team guide),"Shows how to monitor OCI DevOps pipelines with OCI Monitoring, Logging, Logging Analytics, Events, and alert automation.",Build; Operate,Automation; Observability and tracing,4,oracle-llmops,,CI/CD observability; DevOps pipeline performance monitoring,Oracle; OCI DevOps; CI/CD; Observability,LLMOps engineer; Platform engineer,https://www.ateam-oracle.com/monitor-oci-devops-performance-observability-and-management
Phoenix tracing overview (LLM traces),Lesson on Phoenix tracing overview (LLM traces).,Operate,Observability and tracing,1,phoenix-observability,,LLM tracing concepts; Trace analysis for debugging,Phoenix; Tracing; Observability; Debugging,LLMOps engineer,https://arize.com/docs/phoenix/tracing/llm-traces
Phoenix tracing: how-to (manual),Lesson on Phoenix tracing: How-to (manual).,Operate,Observability and tracing,2,phoenix-observability,,Tracing instrumentation; Trace export to Phoenix,Phoenix; Instrumentation; Tracing; How-to,LLMOps engineer,https://arize.com/docs/phoenix/tracing/how-to-tracing
Phoenix tracing tutorial,Lesson on Phoenix tracing tutorial.,Build; Operate,Observability and tracing; Orchestration and workflows,3,phoenix-observability,,Tracing tutorial workflow; End-to-end run debugging,Phoenix; Tutorial; Tracing; Hands-on,LLMOps engineer; LLM application engineer,https://arize.com/docs/phoenix/tracing/tutorial
Phoenix docs section index (tracing/evals/datasets),Lesson on Phoenix docs section index (tracing/evals/datasets).,Evaluate; Operate,Observability and tracing; Evaluation and Testing,4,phoenix-observability,,Observability + eval workflow navigation; Dataset/eval operations,Phoenix; Evals; Datasets; Observability,Evaluation engineer; LLMOps engineer; Platform engineer; LLM application engineer,https://arize.com/docs/phoenix
vLLM Docs (landing),Lesson on vLLM docs (landing).,Build; Optimize,Deployment and serving; Cost and performance,1,vllm-serving,,vLLM installation & setup; Efficient inference serving,vLLM; Serving; Inference; Open-source; Performance,Evaluation engineer; Platform engineer,https://docs.vllm.ai/
OpenAI-compatible server (docs),Lesson on OpenAI-compatible server (docs).,Build,Deployment and serving,2,vllm-serving,,OpenAI-compatible server (vLLM); API endpoint configuration,vLLM; OpenAI-compatible API; Server; Serving,Platform engineer; ML engineer,https://docs.vllm.ai/en/v0.13.0/serving/openai_compatible_server/
vLLM GitHub repository,Lesson on vLLM GitHub repository.,Build,Deployment and serving,3,vllm-serving,,Source build & dependency management; Upstream contribution workflow,vLLM; GitHub; Build; Open-source,Platform engineer; LLM application engineer,https://github.com/vllm-project/vllm
vLLM: Serving guides index,Lesson on vLLM: serving guides index.,Build; Operate,Deployment and serving; Observability and tracing,4,vllm-serving,,Production deployment patterns (vLLM); Operational serving configuration,vLLM; Deployment; Ops; Serving guides,LLMOps engineer; Platform engineer,https://docs.vllm.ai/en/latest/serving/offline_inference/
